{
  "$schema": "https://json-schema.org/draft/2020-12/schema",
  "$id": "https://htdt.example/schemas/capture-bundle-v1/field-notes.schema.json",
  "title": "HTDT Capture Field Notes v1",
  "type": "object",
  "additionalProperties": false,
  "required": [
    "schema",
    "schema_version",
    "capture_revision_id",
    "updated_at",
    "notes"
  ],
  "properties": {
    "schema": { "const": "htdt.capture.field_notes" },
    "schema_version": { "const": "1.0.0" },
    "capture_revision_id": { "$ref": "#/$defs/uuid4" },
    "capture_session_id": { "$ref": "#/$defs/uuid4" },
    "updated_at": { "$ref": "#/$defs/utcTimestamp" },
    "notes": {
      "type": "array",
      "items": { "$ref": "#/$defs/note" }
    }
  },
  "$defs": {
    "uuid4": {
      "type": "string",
      "pattern": "^[0-9a-f]{8}-[0-9a-f]{4}-4[0-9a-f]{3}-[89ab][0-9a-f]{3}-[0-9a-f]{12}$"
    },
    "utcTimestamp": {
      "type": "string",
      "format": "date-time",
      "pattern": "^\\d{4}-\\d{2}-\\d{2}T\\d{2}:\\d{2}:\\d{2}(\\.\\d+)?Z$"
    },
    "note": {
      "type": "object",
      "additionalProperties": false,
      "required": [
        "note_id",
        "capture_revision_id",
        "created_at",
        "category",
        "text",
        "needs_attention",
        "binding_refs",
        "evidence_refs",
        "authoring_method",
        "status"
      ],
      "properties": {
        "note_id": { "$ref": "#/$defs/uuid4" },
        "capture_revision_id": { "$ref": "#/$defs/uuid4" },
        "capture_session_id": { "$ref": "#/$defs/uuid4" },
        "created_at": { "$ref": "#/$defs/utcTimestamp" },
        "session_timestamp_seconds": {
          "type": "number",
          "minimum": 0
        },
        "category": {
          "type": "string",
          "pattern": "^[a-z0-9_]{1,128}$"
        },
        "text": { "type": "string", "minLength": 1 },
        "severity": {
          "enum": ["observation", "concern", "hazard"]
        },
        "needs_attention": { "type": "boolean" },
        "binding_refs": {
          "type": "array",
          "items": { "type": "string", "minLength": 1 }
        },
        "evidence_refs": {
          "type": "array",
          "items": { "type": "string", "minLength": 1 }
        },
        "spatial_position": {
          "type": "object",
          "additionalProperties": false,
          "required": ["coordinate_space_id", "point_meters"],
          "properties": {
            "coordinate_space_id": { "$ref": "#/$defs/uuid4" },
            "point_meters": {
              "type": "object",
              "additionalProperties": false,
              "required": ["x", "y", "z"],
              "properties": {
                "x": { "type": "number" },
                "y": { "type": "number" },
                "z": { "type": "number" }
              }
            }
          }
        },
        "authoring_method": { "enum": ["typed", "dictated"] },
        "operator_id": { "$ref": "#/$defs/uuid4" },
        "status": {
          "enum": ["active", "resolved", "superseded"]
        },
        "supersedes_note_id": { "$ref": "#/$defs/uuid4" },
        "superseded_by_note_id": { "$ref": "#/$defs/uuid4" },
        "resolved_at": { "$ref": "#/$defs/utcTimestamp" }
      }
    }
  }
}
