{"capture_revision_id":"81e4985b-3169-49a4-b76c-8316a7145117","capture_session_id":"0f936474-e29d-415d-9691-b52faed6227b","notes":[{"authoring_method":"typed","binding_refs":[],"capture_revision_id":"81e4985b-3169-49a4-b76c-8316a7145117","capture_session_id":"0f936474-e29d-415d-9691-b52faed6227b","category":"room_condition","created_at":"2026-10-03T01:42:46Z","evidence_refs":[],"needs_attention":false,"note_id":"d532358a-c7c3-4e90-9473-182e7304b9f8","status":"active","text":"Glass wall on the north side"}],"schema":"htdt.capture.field_notes","schema_version":"1.0.0","updated_at":"2026-10-03T01:42:46Z"}